D0000017;D00023493;Мотопомпа CHAMPION GP26-II 2тактная
D0000017;D00016955;Насадка пильная сегментная BIM 80мм для МФИ
D0000017;D00016952;Насадка пильная сегментная HCS 88мм для МФИ
D0000017;D00022856;Нож CHAMPION для жесткой травы 4/230/25,4 (тип А)
D0000017;D00051112;Угловая шлифмашина Интерскол УШМ-125/900
D0002026;D00045598;Бензопила PIT GCS-52-D1 СТАНДАРТ
D0002026;K00035214;Пила дисковая PIT РКS185-C2
D0002026;S00009778;Сверло перовое по дереву 18x152 Энкор
D0002026;S00009784;Сверло перовое по дереву 26x152 Энкор
D0002026;K00036698;Угловая шлифмашина Patriot AG150
D0002432;D00049110;Насос скважинный Aquario ASP1.8E-63-90 встр.конд
D0002432;K00036437;Реле давления Р1-5 вращ. гайка Хозяин
D0006531;K00036698;Угловая шлифмашина Patriot AG150
D0007223;D00042842;Опрыскиватель CHAMPION SA16 аккумуляторный
D0007223;D00044186;Опрыскиватель PATRIOT PT-12AC аккумуляторный
D0008234;K00038572;Мотоблок ЦЕЛИНА МБ-910Р без фрез
D0009039;D00022261;Насос скважинный Aquario ASP3E-55-90
D0010456;D00008398;Насос скважинный Aquario ASP1E-45-90
D0010568;K00035474;Бензогазонокосилка CHAMPION LM5345 самоходная
D0010845;D00041019;Дрель ударная Интерскол ДУ-13/650ЭР+
D0010922;D00030691;Бензокоса CHAMPION T256-2
D0010922;D00043720;Диск пильный 185x30x24 Verto
D0010922;D00020114;Емкость CHAMPION 1л д/приготовления топливной смес
D0010922;K00035214;Пила дисковая PIT РКS185-C2
D0010922;K00036041;Силикон Soudal белый универсальный 60 гр.
D0011602;D00030313;Бетоносмеситель Калибр БСЭ-160
D0011721;K00033545;Станция насосная Aquario AUTO AJC-101
D0011763;D00028981;Станция насосная Джилекс Джамбо 50/28 Ч-18
D0011783;D00040383;Измельчитель зерна ФЕРМЕР ИЗЭ-05  170 кг/ч
D0011783;D00040384;Измельчитель зерна ФЕРМЕР ИЗЭ-05М 250кг/ч
D0011783;D00040385;Измельчитель зерна ФЕРМЕР ИЗЭ-14 300кг/ч
D0011783;K00035962;Леска CHAMPION Aluminium 3.0мм*168м (круглый)+нож
D0011783;D00012506;Леска CHAMPION Star 3.0мм* 164м (звезда)
D0011783;D00026825;Леска CHAMPION Twisted Square 3.0мм*164м вит.квадр
D0011783;K00036177;Леска MOST GARDEN 3,0мм * 265 м (круг)
D0011783;D00042796;Угловая шлифмашина Интерскол УШМ-115/800
D0011783;D00042832;Угловая шлифмашина Интерскол УШМ-230/2000М ДМ
D0012391;S00002773;Дрель Makita 6408
D0012391;D00045663;Дрель аккумуляторная Makita DF333DWYE
D0012391;K00036289;Дрель аккумуляторная Makita DF347DWE
D0012391;K00035337;Дрель аккумуляторная Makita DF347DWLE
D0012391;K00036302;Дрель ударная Makita HP1630
D0012391;D00003328;Лобзик Makita 4327
D0012391;D00001684;Лобзик Makita 4329
D0012391;D00033517;Перфоратор Makita HR2460
D0012391;K00036303;Перфоратор Makita HR2470X15+набор буров
D0012391;K00036439;Пила дисковая Makita HS6601
D0012391;D00028751;Угловая шлифмашина Makita 9069F
D0012391;S00011910;Угловая шлифмашина Makita 9562CH
D0012391;K00038984;Угловая шлифмашина Makita 9565CR
D0012391;D00000542;Угловая шлифмашина Makita 9565HZ
D0012391;D00014005;Угловая шлифмашина Makita GA4530
D0012391;P00000219;Угловая шлифмашина Makita GA9020
D0012391;D00019913;Фен строительный Makita HG551V
D0012391;D00025563;Шуруповерт Makita FS4000
D0012459;D00023563;Дрель ударная Калибр ДЭ-580ЕРУ
D0012459;D00020392;Дрель-шуруповёрт Калибр ДЭ-310ш
D0012459;D00043080;Ножницы по металлу  PATRIOT ASP-250R, правый рез
D0012459;D00043715;Рулетка 30м, стальная лента, Topex
D0012773;D00014645;Головка триммерная CHAMPION HT28 Болт М6х1.00 П
D0012773;D00026791;Головка триммерная CHAMPION HT40 Гайка М8*1.25 Л
D0012773;K00033957;"Измельчитель зерна ""ТермМикс"" 450кг/ч"
D0012773;D00043638;Инкубатор Золушка 98 яиц,авто. 220В, УЗБИ
D0012773;D00050881;Кожух защитный триммера под штангу D 26mm тип2
D0012773;D00041880;Круг шлифовальный 200х20х32 63С 40 K,L 40СМ Луга
D0012773;K00036017;Маска защитная SIAT STANDART (СЕТКА)
D0012773;K00039328;Нож MOST 40/255/25,4 с твердосплавными зубцами
D0012773;K00039320;Нож MOST 8/255/25,4
D0013104;D00040384;Измельчитель зерна ФЕРМЕР ИЗЭ-05М 250кг/ч
D0013104;D00040385;Измельчитель зерна ФЕРМЕР ИЗЭ-14 300кг/ч
D0013104;D00040387;Измельчитель зерна ФЕРМЕР ИЗЭ-25  350 кг/ч
D0013104;D00052628;Сито боковое для измельчителя ИЗЭ d3 Фермер
D0013104;D00051099;Сито боковое для измельчителя ИЗЭ d4 лента (а)
D0013109;D00028357;Карбюратор T334FS нового образца
D0013109;D00051102;Предохранитель (для измельчителя 14М/25М) 6х30 10А
D0013109;D00038375;Сцепление в сборе д/ВС45CGT(54)
D0013109;D00006669;Уплотнение торцевое 12мм
D0013109;D00009798;Уплотнение торцевое 14мм AJC-125 (а)
D0013109;D00025635;Уплотнение торцевое D12-D24-20,5
O0000063;K00037466;Набор коронок карбидных по керамике 6 пред.
O0000063;D00016952;Насадка пильная сегментная HCS 88мм для МФИ
O0000410;K00033573;Масло для цепи минеральное 1 L MAXCUT
O0000429;K00039128;"Картридж веревочный ВП-10 М Slim Line 10"""
O0000429;D00045365;Корпус картриджного фильтра АБФ-10-34 Slim Line 10
O0000429;D00001931;Насос повысительный Aquario AC  159-160A
O0000429;D00045608;Станция насосная JEMIX ATQB-60-mini
